user_name,user_location,user_description,user_created,user_followers,user_friends,user_favourites,user_verified,date,text,hashtags,source,is_retweet,parsed_date,only_date,only_time,datetime_for_sorting
AMH,Chicago,"learning specialist by day, kitchen diva by night; tech junkie; singer; friend",2008-07-16 13:39:28,256.0,1164,405,False,2021-01-25 21:10:29,"One dose down; one more to go!

#COVID19 #quotes #COVIDVaccine #DoseOne @ Rogers Park, Chicago https://t.co/C1uU0d30Yu","['COVID19', 'quotes', 'COVIDVaccine', 'DoseOne']",Instagram,False,2021-01-25 21:10:29,2021-01-25,21:10:29,2021-01-25 21:10:29
Carrol Van Stone,"Washington, DC Metro Area","National freelance publicist & media strategist for executives, authors, experts, entrepreneurs, companies, nonprofits & public policy initiatives",2012-12-11 02:43:10,421.0,2071,238,False,2021-01-25 21:10:30,Excellent insights on #CovidVaccine #supplychains #distribution #covid #vaccination https://t.co/Nrdqpb9Ozt,"['CovidVaccine', 'supplychains', 'distribution', 'covid', 'vaccination']",Twitter Web App,False,2021-01-25 21:10:30,2021-01-25,21:10:30,2021-01-25 21:10:30
"Zachary Rubin, MD","Naperville, IL",Pediatric Allergist/Immunologist practicing in my hometown. Clarifying food allergies is my career passion. Got COVID-19 💉 questions? Let’s talk!,2015-09-28 17:19:30,677.0,546,2224,False,2021-01-25 21:10:34,"Comparing #CovidVaccine #anaphylaxis rate to car crashes 🧵

https://t.co/LLmhfLweTi","['CovidVaccine', 'anaphylaxis']",Twitter Web App,False,2021-01-25 21:10:34,2021-01-25,21:10:34,2021-01-25 21:10:34
"Zachary Rubin, MD","Naperville, IL",Pediatric Allergist/Immunologist practicing in my hometown. Clarifying food allergies is my career passion. Got COVID-19 💉 questions? Let’s talk!,2015-09-28 17:19:30,677.0,546,2224,False,2021-01-25 21:10:34,"When does the #CovidVaccine become effective based on the phase III studies? A visual here (in English and Spanish)

https://t.co/48WJB3afcY",['CovidVaccine'],Twitter Web App,False,2021-01-25 21:10:34,2021-01-25,21:10:34,2021-01-25 21:10:34
"Zachary Rubin, MD","Naperville, IL",Pediatric Allergist/Immunologist practicing in my hometown. Clarifying food allergies is my career passion. Got COVID-19 💉 questions? Let’s talk!,2015-09-28 17:19:30,677.0,546,2224,False,2021-01-25 21:10:34,"Visualizing #anaphylaxis risk to #CovidVaccine compared to other common medical interventions

https://t.co/Iwt5ZRc1xU","['anaphylaxis', 'CovidVaccine']",Twitter Web App,False,2021-01-25 21:10:34,2021-01-25,21:10:34,2021-01-25 21:10:34
"Zachary Rubin, MD","Naperville, IL",Pediatric Allergist/Immunologist practicing in my hometown. Clarifying food allergies is my career passion. Got COVID-19 💉 questions? Let’s talk!,2015-09-28 17:19:30,677.0,546,2224,False,2021-01-25 21:10:35,"#Question/#Answer session on #CovidVaccine 

https://t.co/n5MQriAyzw","['Question', 'Answer', 'CovidVaccine']",Twitter Web App,False,2021-01-25 21:10:35,2021-01-25,21:10:35,2021-01-25 21:10:35
Babs S. Harrison,"ÜT: 40.745393,-74.052884",Babs Harrison + Partners | #PR,2009-04-15 15:10:07,1995.0,1659,450,False,2021-01-25 21:10:40,What COVID-19 vaccines will mean for the return of travel https://t.co/C2Xmoaskw9 #CovidVaccine #travel,"['CovidVaccine', 'travel']",Twitter for iPhone,False,2021-01-25 21:10:40,2021-01-25,21:10:40,2021-01-25 21:10:40
Emma Lockwood,,"PA, top class mum, awesome sister, fun loving auntie, amazing wife and organiser",2015-05-21 21:13:44,85.0,256,2834,False,2021-01-25 21:10:44,"@dixiedeansboots @MerseyFire @stjohnambulance 👏 👏 well done, amazing job everyone is doing #CovidVaccine",['CovidVaccine'],Twitter for iPhone,False,2021-01-25 21:10:44,2021-01-25,21:10:44,2021-01-25 21:10:44
CatskillJulie: WE DID IT! President Joe VP Kamala,Reality: There is no Planet B,"NatSec Dem! 
BidenHarris TeamPelosi ProChoice Climate Science DrFauci
TraitorTrump PutinsPuppet GOPComplicit PutinsGOP BLM COVID19 = MaskUp StayHome Vaccinate!",2009-07-28 22:40:39,2101.0,1744,55551,False,2021-01-25 21:11:09,"Well, @JoeManchinWV @SenatorSinema? DO you two want to serve in the Majority? 

What remedy will you support to sto… https://t.co/xE5VofeLiR",,Twitter Web App,False,2021-01-25 21:11:09,2021-01-25,21:11:09,2021-01-25 21:11:09
Somerset Lieutenancy,"Somerset, United Kingdom","News from the office of The Lord Lieutenant, Annie Maw and the Lieutenancy representing Her Majesty The Queen in Somerset",2018-04-16 13:15:39,431.0,132,1550,False,2021-01-25 21:11:21,"Annie Maw remarked that “It was just tremendous to see so many people doing such a great task as a team, in good sp… https://t.co/flJKi1daBM",,Twitter Web App,False,2021-01-25 21:11:21,2021-01-25,21:11:21,2021-01-25 21:11:21
