user_name,user_location,user_description,user_created,user_followers,user_friends,user_favourites,user_verified,date,text,hashtags,source,is_retweet,parsed_date,only_date,only_time,datetime_for_sorting
VaxBLR,"Bengaluru, India","Hourly updates on FREE and PAID 18+ and 45+ vaccine slot availability across #Bengaluru BBMP,URBAN & RURAL",2021-06-21 08:44:34,38.0,0.0,0.0,False,2022-04-15 12:00:14,"45+ #URBAN #Bengaluru #CovidVaccine Availability for 15/04 at 05:30PM
FREE Slots 0
PAID Slots 0","['URBAN', 'Bengaluru', 'CovidVaccine']",VaxBlr,False,2022-04-15 12:00:14,2022-04-15,12:00:14,2022-04-15 12:00:14
VaxBLR,"Bengaluru, India","Hourly updates on FREE and PAID 18+ and 45+ vaccine slot availability across #Bengaluru BBMP,URBAN & RURAL",2021-06-21 08:44:34,38.0,0.0,0.0,False,2022-04-15 12:00:25,"45+ #BBMP #Bengaluru #CovidVaccine Availability for 15/04 at 05:30PM
FREE Slots 0
PAID Slots 0","['BBMP', 'Bengaluru', 'CovidVaccine']",VaxBlr,False,2022-04-15 12:00:25,2022-04-15,12:00:25,2022-04-15 12:00:25
Health Imaging,United States,"Breaking news & insightful reporting on the science, business and practice of radiology and medical imaging. https://t.co/6r6iUI8JHF",2009-03-31 18:45:06,18315.0,894.0,908.0,False,2022-04-15 12:02:16,FDG PET/CT radiomics can differentiate between COVID vaccine-related adenopathy and swelling in the lymph nodes due to breast cancer metastases #covidvaccine https://t.co/PWGJsayM70,['covidvaccine'],Hootsuite Inc.,False,2022-04-15 12:02:16,2022-04-15,12:02:16,2022-04-15 12:02:16
Andhravilas,USA,"Andhravilas Gives you  #Tollywood #Bollywood film News,#AndhraPradesh #Telangana News,#National    #Health #Business  #Trending Visit
https://t.co/vJFjY4CwOT",2010-05-10 15:40:09,2600.0,92.0,27.0,False,2022-04-15 12:04:04,"Eyeing polls, Himachal CM announces 125 units of free power https://t.co/TroU8UcyCX #indiapolitics #Breakingnews #Indiapolitics #AndhraPolitics #NewsFeed #RadheShyam #breakingnews #CovidVaccine 

Chamba (Himachal Pradesh), April 15 - In the election year, Chief Minister Jai Ra…","['indiapolitics', 'Breakingnews', 'Indiapolitics', 'AndhraPolitics', 'NewsFeed', 'RadheShyam', 'breakingnews', 'CovidVaccine']",IFTTT,False,2022-04-15 12:04:04,2022-04-15,12:04:04,2022-04-15 12:04:04
Philip Lewis,"Georgia, USA",,2009-07-13 20:09:56,162.0,459.0,45.0,False,2022-04-15 12:08:02,"Are Second Covid Booster Shots Effective? What Experts Know So Far https://t.co/hiW9a5L8Vi 

#Covid #Vaccine #CovidVaccine #CovidBooster https://t.co/ibTe0GKlDp","['Covid', 'Vaccine', 'CovidVaccine', 'CovidBooster']",Buffer,False,2022-04-15 12:08:02,2022-04-15,12:08:02,2022-04-15 12:08:02
Jane Brown,"Toronto, ON",Assoc. News Director of @MosesZnaimer's radio stations @zoomerradio @classical963fm / The Morning Zoom wi Sam & Jane / @BladderCancerCA Advocate #InMemoryOfMom,2013-02-28 16:39:40,3050.0,1708.0,8805.0,False,2022-04-15 12:08:23,"Still COVID free 25 months in (that I know of). Come on, let the 55-59s have a 4th shot too! #onpoli @ONThealth #CovidVaccine #BoosterClub","['onpoli', 'CovidVaccine', 'BoosterClub']",Twitter Web App,False,2022-04-15 12:08:23,2022-04-15,12:08:23,2022-04-15 12:08:23
PEG Benefits,"Georgia, USA",Profit Enhancement Groups vision is to be a highly trusted and deeply passionate advisor dedicated to the overall success of #Entrepreneurs and our #partners.,2015-07-07 19:55:01,57.0,427.0,136.0,False,2022-04-15 12:16:03,"Are Second Covid Booster Shots Effective? What Experts Know So Far https://t.co/DdKM9H9Vxg 

#Covid #Vaccine #CovidVaccine #CovidBooster https://t.co/zrsqsNlg1t","['Covid', 'Vaccine', 'CovidVaccine', 'CovidBooster']",Buffer,False,2022-04-15 12:16:03,2022-04-15,12:16:03,2022-04-15 12:16:03
🍊Katerina5k🍊,"Brooklyn, NY","#OrthodoxChristian, #ProLife, registered #Conservative from NY. Extreme views include a love of #family #cats #unalienablerights & #USA.  #TrumpWon",2012-03-20 17:39:06,1143.0,1979.0,15321.0,False,2022-04-15 12:52:13,"Millions got covid in 2020, and aren't #vaccinated nor have they gotten reinfected👋 

Too many #CovidVaccine adverse effects have come to light. Perhaps when #ElonMusk takes over twitter, we can have HONEST debate abt #COVID, not propaganda. #PureBlood https://t.co/gNTRRK7J8M","['vaccinated', 'CovidVaccine', 'ElonMusk', 'COVID', 'PureBlood']",Twitter Web App,False,2022-04-15 12:52:13,2022-04-15,12:52:13,2022-04-15 12:52:13
Ak'Arinanye,"Mbarara, Uganda","Social Sector planner, Policy analyst, administrator, researcher and Social Commentator.",2016-06-18 20:22:30,121.0,174.0,614.0,False,2022-04-15 12:57:59,"@rising_serpent If any athlete took the trial #CovidVaccine , end your career or you are sent in an early grave.",['CovidVaccine'],Twitter for Android,False,2022-04-15 12:57:59,2022-04-15,12:57:59,2022-04-15 12:57:59
Prime Indexes,"New York, NY","We create financial indexes based on principles of intuitive selection criteria, common sense factors, and emerging industry research.",2016-09-16 01:45:20,1127.0,3500.0,1080.0,False,2022-04-15 13:00:02,"CanSinoBIO's mRNA COVID Vaccine Candidate Cleared for Trials in China: https://t.co/k7KsYUgCDL

@ETFMG #mrnavaccine #vaccinerevenue #vaccinenews #covidvaccine","['mrnavaccine', 'vaccinerevenue', 'vaccinenews', 'covidvaccine']",TweetDeck,False,2022-04-15 13:00:02,2022-04-15,13:00:02,2022-04-15 13:00:02
