user_name,user_location,user_description,user_created,user_followers,user_friends,user_favourites,user_verified,date,text,hashtags,source,is_retweet,parsed_date,only_date,only_time,datetime_for_sorting
Salma Khan,"Islamabad, Pakistan","A dreamer, a blogger, a scientist, a chef, a vlogger, an artist, a social activist.
Creativity is intelligence having fun",2020-11-27 10:45:11,28.0,22.0,175.0,False,2021-08-05 07:47:36,"So true
#vaccinated #VaccinePassport #COVID19 #CovidVaccine https://t.co/ZFhpx205ln","['vaccinated', 'VaccinePassport', 'COVID19', 'CovidVaccine']",Twitter for Android,False,2021-05-08 07:47:36,2021-05-08,07:47:36,2021-05-08 07:47:36
PopopThePatriot 🇺🇸🗽🔔☠️,"NE Florida, USA",#FiercelyConversing: Constitutional Conservative Activist. Independent Journalist. Examinine Current Events; Engage in Civil Debate. #IMHO #DAV #USN #1A #2A,2021-07-01 10:12:00,389.0,1480.0,575.0,False,2021-08-05 07:49:42,What if #CovidVaccine is just a large-scale test for phase II of Faucci’s genetic testing and engineering of biologically weaponized viruses 🦠? 🤔💨,['CovidVaccine'],Twitter for iPhone,False,2021-05-08 07:49:42,2021-05-08,07:49:42,2021-05-08 07:49:42
The Newsmen,,"Your daily supplement of news, facts, analysis & opinion pieces. 📰
Participate in group discussions. GET THE APP NOW 
https://t.co/jF7n5puUXQ",2019-09-18 14:53:13,1819.0,804.0,89.0,False,2021-08-05 07:50:26,"The #WorldHealthOrganisation (WHO) has asked rich countries to pause the roll out of #BoosterShots   against #COVID19 till the end of September, to help poorer nations get doses.
#WHO #COVID19 #CovidVaccine 

https://t.co/WmaPnhtMpY","['WorldHealthOrganisation', 'BoosterShots', 'COVID19', 'WHO', 'COVID19', 'CovidVaccine']",Twitter Web App,False,2021-05-08 07:50:26,2021-05-08,07:50:26,2021-05-08 07:50:26
Fovle,,For you and your loved ones,2020-04-04 14:59:23,754.0,2297.0,2.0,False,2021-08-05 07:51:02,ow_ly: '📢Get your #CovidVaccine in Timperley this week! 📍 💉Pfizer &amp; AstraZeneca 1st &amp; 2nd doses… ' https://t.co/MP1ZKsmPue,['CovidVaccine'],fovle,False,2021-05-08 07:51:02,2021-05-08,07:51:02,2021-05-08 07:51:02
Merton Council,Merton,"This account is monitored Mon-Fri, 9am-5pm

📨 Get our COVID-19 e-newsletter➡️ https://t.co/irxqBee0AU

Our guidelines➡️ https://t.co/MSsexFgTjN",2009-08-05 11:40:57,14056.0,1969.0,668.0,False,2021-08-05 07:51:41,"The Nelson Health Centre is the location of todays walk-in #CovidVaccine session 💉

No bookings required. They are open from 8.40 am to 7.20 pm for anyone 18+ looking for their 1st or 2nd dose (8 weeks+) Pfizer &amp; AZ or looking to get some questions answered 👇

#KeepMertonSafe https://t.co/qoVz1HdWE9","['CovidVaccine', 'KeepMertonSafe']",Hootsuite Inc.,False,2021-05-08 07:51:41,2021-05-08,07:51:41,2021-05-08 07:51:41
Fiona de Faoite,"London, England","Actor/Director/Singer/Writer/Jack of all Trades
She/Her",2010-03-19 21:52:17,1060.0,1050.0,53269.0,False,2021-08-05 07:55:19,Just left home to go home for the first time in 18 months. #homewardbound #Ireland #CovidVaccine,"['homewardbound', 'Ireland', 'CovidVaccine']",Twitter for Android,False,2021-05-08 07:55:19,2021-05-08,07:55:19,2021-05-08 07:55:19
@LiuBaoBei 🇬🇧🇭🇰,Amidst the battle for freedom,"GETTR 
@LiuBaoBei1",2020-04-02 22:00:20,466.0,330.0,32487.0,False,2021-08-05 07:56:02,"Their personality alone is enough to reassure me in on the right side

The people opposing #VaccinePassports and #CovidVaccine do so with labels like #Freedom

Those following the media narrative do so with hateful labels to insult, life #antivax

They're disgusting https://t.co/zQ68X1kjaF","['VaccinePassports', 'CovidVaccine', 'Freedom', 'antivax']",Twitter for Android,False,2021-05-08 07:56:02,2021-05-08,07:56:02,2021-05-08 07:56:02
NHS North West,,We are @NHSEngland and @NHSImprovement working together in the North West. This account is only monitored between Monday-Friday 9am-5pm.,2019-01-08 09:46:08,5436.0,799.0,1711.0,True,2021-08-05 07:56:32,"9⃣ MILLION doses of #CovidVaccine has been given across the North West!

Following the announcement that 4 million have had both doses, this is overwhelming 🥲🙂 

Thank you everyone who has taken part for helping us all get back to life 💙

#CovidVaccineNW #9millionandcounting https://t.co/szcYWQZxcn","['CovidVaccine', 'CovidVaccineNW', '9millionandcounting']",Twitter Web App,False,2021-05-08 07:56:32,2021-05-08,07:56:32,2021-05-08 07:56:32
Bradford Teaching Hospitals NHS FT #GrabAJab,"Bradford, West Yorkshire","We deliver high-quality healthcare from sites across Bradford. Supported by @BTHFTCharity. Need A&E? Unless it's an emergency, please visit https://t.co/W3IXy2RXvA",2011-09-21 20:30:39,8581.0,1080.0,16935.0,True,2021-08-05 07:57:06,"Not had your #CovidVaccine yet? Over 18? Come down to the NHS walk-in session TODAY at The Broadway, Bradford and #GrabAJab.

Adam Brian, 34, of Clayton, had his vaccine yesterday. Find out why 👇

Alternatively, visit a walk-in clinic near you: https://t.co/EygbFX0zuw https://t.co/fTU2d7WHgP","['CovidVaccine', 'GrabAJab']",Twitter for iPhone,False,2021-05-08 07:57:06,2021-05-08,07:57:06,2021-05-08 07:57:06
MyGovIndia,New Delhi,"Citizen engagement platform of Government of India, giving people the opportunity to work towards Surajya with their ideas & grass root level contribution.",2014-07-28 06:57:18,2662234.0,326.0,1212.0,True,2021-08-05 07:57:23,"Hon'ble PM @narendramodi interacts with beneficiaries of the PMGKAY in #UttarPradesh; Smt. Amlavati ji shares that she happy to monthly receive ration, says that she is #Vaccinated and has ensured her family also took the #COVIDVaccine. Watch Live: https://t.co/1pk0j68qTH","['UttarPradesh', 'Vaccinated', 'COVIDVaccine']",Twitter Web App,False,2021-05-08 07:57:23,2021-05-08,07:57:23,2021-05-08 07:57:23
