user_name,user_location,user_description,user_created,user_followers,user_friends,user_favourites,user_verified,date,text,hashtags,source,is_retweet,parsed_date,only_date,only_time,datetime_for_sorting
SABC News,South Africa,The digital news portal of the South African Broadcasting Corporation.,2009-03-18 15:16:33,1856260.0,589.0,171.0,True,2021-02-28 18:33:19,"The Lockdown Level 1 hours of the #curfew will now be from 12 midnight to 4am, effective from midnight. #SABCNews… https://t.co/gRb08eqRq0","['curfew', 'SABCNews']",Twitter Web App,False,2021-02-28 18:33:19,2021-02-28,18:33:19,2021-02-28 18:33:19
Sue Volpato,,Just a busy mom in a busy world.,2013-04-25 18:42:44,21.0,184.0,26.0,False,2021-02-28 18:33:48,@Walgreens in the real world u get ur 1st shot and before U leave you get your 2nd shot apt. #COVIDVaccine,['COVIDVaccine'],Twitter for iPhone,False,2021-02-28 18:33:48,2021-02-28,18:33:48,2021-02-28 18:33:48
SABC News,South Africa,The digital news portal of the South African Broadcasting Corporation.,2009-03-18 15:16:33,1856260.0,589.0,171.0,True,2021-02-28 18:34:40,Indoor gatherings under Lockdown Level 1 may not exceed 50% of the venue capacity and may not be more than 100 peop… https://t.co/HyESi4svXD,,Twitter Web App,False,2021-02-28 18:34:40,2021-02-28,18:34:40,2021-02-28 18:34:40
Caroline Lee,,"Nosical ramblings of a Wife of 1, Mum of 1, Step-mum of 2 & SuperGran to 3! BFF of many, yay! (Pic due to my husband thinking I'm Ratty - Wind in the willows)",2019-11-05 17:00:49,8.0,123.0,290.0,False,2021-02-28 18:35:12,And I’m jabbed! #COVIDVaccine,['COVIDVaccine'],Twitter for iPhone,False,2021-02-28 18:35:12,2021-02-28,18:35:12,2021-02-28 18:35:12
Sue Volpato,,Just a busy mom in a busy world.,2013-04-25 18:42:44,21.0,184.0,26.0,False,2021-02-28 18:35:26,@Walgreens called the store to ask about the vaccine- sent us to the website #COVIDVaccine  just STUPID. You make i… https://t.co/At57APkIMx,['COVIDVaccine'],Twitter for iPhone,False,2021-02-28 18:35:26,2021-02-28,18:35:26,2021-02-28 18:35:26
Sue Volpato,,Just a busy mom in a busy world.,2013-04-25 18:42:44,21.0,184.0,26.0,False,2021-02-28 18:36:41,@Walgreens #COVIDVaccine  #elderly  #EpicFail  Walgreens you get a F in elderly appointments for the vaccine.,"['COVIDVaccine', 'elderly', 'EpicFail']",Twitter for iPhone,False,2021-02-28 18:36:41,2021-02-28,18:36:41,2021-02-28 18:36:41
RUNN247,San Diego,6x Ironman 70.3 finisher. Training for #IM703IndianWells. Living in paradise.,2013-08-19 13:57:13,2760.0,2689.0,87965.0,False,2021-02-28 18:38:17,First shot done! ✅ #COVIDVaccine https://t.co/ATaBvo31qX,['COVIDVaccine'],Twitter for iPhone,False,2021-02-28 18:38:17,2021-02-28,18:38:17,2021-02-28 18:38:17
Zach Clark,*Points to right hand*,Anchor/Reporter: @WWJ950 || @KAMP_Radio alum || TikTok: brewmanchew || Will drink beer for clout,2009-03-25 22:15:58,2136.0,353.0,19738.0,False,2021-02-28 18:40:26,"Reading the news on @WWJ950 from 2-7:35p

-@NYKnicks @ @DetroitPistons at 7:35 on AM 950
-1 killed, 2 injured in St… https://t.co/c9OvJfBGNI",,Twitter Web App,False,2021-02-28 18:40:26,2021-02-28,18:40:26,2021-02-28 18:40:26
Margaret Nevinski,,Writer. Teacher. Islander. Walker. @VCFAWCYA. Coffee and book lover. Represented by @Jacqui_Lipton at @RavenLiterary. #amwriting #WritingCommunity #kidlit,2018-01-22 22:14:44,735.0,1228.0,3188.0,False,2021-02-28 18:41:07,@jane_danielson I'm sorry to hear about your mom. Getting the #COVIDVaccine is a wonderful tribute to her.,['COVIDVaccine'],Twitter Web App,False,2021-02-28 18:41:07,2021-02-28,18:41:07,2021-02-28 18:41:07
ChynnaBlue,Texas,Blue Dot in a Red State,2009-12-02 17:17:46,553.0,3500.0,36861.0,False,2021-02-28 18:43:01,"Got my first dose of the Pfizer #COVIDVaccine yesterday. My left arm is sore, but no other side effects. Looking fo… https://t.co/RTyUTIaxTR",['COVIDVaccine'],Twitter for iPhone,False,2021-02-28 18:43:01,2021-02-28,18:43:01,2021-02-28 18:43:01
